{
  "_doc": "LP Mitsubishi Pajero Sport — passeio/comercial leve. Curadoria manual (M8 sem aplicações curadas).",
  "slug": "pajero-sport",
  "categoria": "bico-injetor",
  "veiculo_key": "pajero-sport",
  "veiculo": {
    "marca_aliases": [
      "MITSUBISHI"
    ],
    "modelo_aliases": [
      "PAJERO SPORT",
      "PAJEROSPORT"
    ],
    "motor_por_cv": {
      "181": "2.4 MIVEC Diesel",
      "190": "2.4 MIVEC Diesel"
    }
  },
  "hero": {
    "eyebrow": "COMPRA SEGURA. ENTREGA GARANTIDA.",
    "h1_linha1": "BICO INJETOR",
    "h1_linha2": "PAJERO SPORT",
    "h1_sub": "Original ou primeira linha",
    "sub": "Para Pajero Sport 2.4 MIVEC Diesel (após 2016).",
    "foto_static": "assets/pajero-sport-static.webp",
    "foto_alt": "Mitsubishi Pajero Sport preta em campo ao entardecer",
    "bg_position_mobile": "65% 50%",
    "bg_position_desktop": "62% center",
    "cta_mobile_label": "ACHAR O BICO CERTO"
  },
  "selector": {
    "titulo_l1": "Encontre o bico certo",
    "titulo_l2": "pro seu Pajero Sport",
    "subtexto": "Consultamos FIPE/Denatran pra você comprar a peça certa."
  },
  "peca": {
    "nome": "BICO INJETOR MITSUBISHI PAJERO SPORT",
    "short_label": "BICO",
    "fabricante_label": "ORIGINAL",
    "fabricante_principal_short": "Denso",
    "motores_label": "2.4 MIVEC Diesel (pós-2016)",
    "fabricantes_aceitos": [
      "Denso"
    ],
    "foto_default": "/injecao-diesel/pecas/0445110189.webp",
    "foto_alt": "Bico injetor original na caixa",
    "fotos_por_oem": {
      "295050-1760": "/injecao-diesel/pecas/0445110189.webp"
    },
    "tem_primeira_linha": true,
    "equivalentes_por_motor": {
      "2.4 MIVEC Diesel": [
        "295050-1760"
      ]
    },
    "bullets_default": [
      "Peça original ou primeira linha",
      "Garantia do fabricante",
      "Pronta entrega de Chapecó/SC"
    ],
    "bullets_unknown": [
      "Peça compatível com seu Pajero Sport",
      "Entrega de Chapecó/SC pra todo Brasil",
      "Garantia de fábrica + Armazém"
    ]
  },
  "result_messages": {
    "default_oem_unknown": "Consulte no WhatsApp",
    "hint_primeira_linha_bold": "Trabalhamos com original e primeira linha",
    "hint_primeira_linha_tail": "— consulte a disponibilidade pro motor exato.",
    "not_supported_default": "Esta LP é específica para Mitsubishi Pajero Sport. Fale com a gente no WhatsApp pra consultar peças do seu veículo."
  },
  "wa": {
    "hero_link": "Olá, quero falar com um vendedor sobre bico injetor pra Pajero Sport.",
    "fab_default": "Olá, cheguei pela landing page e quero falar sobre bico injetor pra Pajero Sport.",
    "result_plate_template": "Olá, consultei a placa {plate} na landing page e vi o bico injetor {oem} pro meu {modelo} {ano} {motor}. Quero cotar.",
    "result_year_template": "Olá, quero cotar o bico injetor {oem} pra Pajero Sport {year} {motor}.",
    "result_dontknow_motor": "Olá, não sei qual é o motor do meu Pajero Sport. Podem me ajudar?",
    "result_notfound_template": "Olá, tentei buscar {query} na landing page e não encontrou. Podem me ajudar?",
    "result_notsupported_template": "Olá, consultei {query} na landing page Pajero Sport e seu veículo é {ident}. Podem me ajudar?",
    "result_error_template": "Olá, tentei consultar {query} na landing page e deu erro. Podem me ajudar?",
    "final_cta": "Olá, quero falar com o vendedor sobre bico injetor pra Pajero Sport."
  },
  "why": {
    "h2_l1": "Bico injetor é segurança.",
    "h2_l2": "Escolha errada",
    "h2_l2_red": "custa caro",
    "items": [
      {
        "num": "01",
        "ttl": "Compatibilidade que não erra.",
        "body": "Nosso sistema cruza sua placa com FIPE/Denatran. Você compra o bico certo pro motor certo, no ano certo seu Pajero Sport. Sem achismo, sem peça voltando."
      },
      {
        "num": "02",
        "ttl": "A marca que o fabricante recomenda.",
        "body": "Trabalhamos com Denso — as marcas de fábrica pro Pajero Sport, com códigos confirmados por motor e ano."
      },
      {
        "num": "03",
        "ttl": "Seu Pajero Sport volta a rodar no mesmo dia.",
        "body": "Estoque em Chapecó/SC. Saída direta pra transportadora no mesmo dia útil da confirmação. Seu Pajero Sport não fica parado esperando peça."
      }
    ]
  },
  "final_cta": {
    "h2_l1": "Pronto pra",
    "h2_l2_red_l1": "voltar",
    "h2_l2_red_l2": "a rodar",
    "sub_pre": "Insira sua placa no",
    "sub_anchor": "seletor acima",
    "sub_post": "ou chame direto no WhatsApp.",
    "btn": "FALAR COM O VENDEDOR AGORA",
    "microtext_pre": "WhatsApp",
    "microtext_post": "— resposta em minutos, de segunda a sexta."
  },
  "technical_block": {
    "_doc": "Bloco técnico-educacional. Reforça keyword Pajero Sport + 2.4 MIVEC Diesel (pós-2016).",
    "heading": "Como saber se o bico injetor seu Pajero Sport está com problema",
    "intro": "O bico injetor seu Pajero Sport (2.4 MIVEC Diesel (pós-2016)) é responsável por atomizar o diesel na câmara de combustão com precisão milimétrica. Quando ele começa a falhar, os sinais aparecem antes da pane total, e identificar cedo evita um conserto de motor muito mais caro.",
    "symptoms": [
      "Fumaça preta ou branca no escapamento",
      "Perda de potência em aceleração e em subida com carga",
      "Consumo de combustível acima do normal",
      "Tranco ao engatar marcha ou marcha lenta irregular",
      "Dificuldade na partida a frio"
    ],
    "quality_explanation": "O bico injetor Denso que o Pajero Sport usa é calibrado de fábrica pro motor específico (2.4 MIVEC Diesel (pós-2016)): pressão de abertura, padrão de pulverização e vedação seguem a especificação do fabricante. Bicos de procedência duvidosa — sem rastreabilidade nem homologação — podem operar fora da faixa correta e causar injeção irregular com danos ao motor a médio prazo.",
    "closing": "Na Armazém, identificamos o bico exato pelo número de placa ou chassi seu Pajero Sport. Estoque disponível pra 2.4 MIVEC Diesel (pós-2016), com despacho no mesmo dia útil."
  },
  "seo": {
    "title": "Bico Injetor Mitsubishi Pajero Sport 2.4 Diesel | Armazém",
    "description": "Bico injetor Mitsubishi Pajero Sport 2.4 MIVEC Diesel (após 2016). Denso 295050-1760 — original e primeira linha. Fale no WhatsApp.",
    "og_image": "assets/pajero-sport-static-og.webp",
    "og_image_alt": "Mitsubishi Pajero Sport em aventura off-road",
    "twitter_description": "Bico injetor Mitsubishi Pajero Sport 2.4 MIVEC Diesel (após 2016). Denso 295050-1760 — original e primeira linha. Fale no WhatsApp.",
    "canonical_path": "/injecao-diesel/pajero-sport/",
    "product": {
      "name": "Bico Injetor para Mitsubishi Pajero Sport (2.4 MIVEC Diesel (pós-2016))",
      "description": "Bico injetor Mitsubishi Pajero Sport 2.4 MIVEC Diesel (após 2016). Denso 295050-1760 — original e primeira linha. Fale no WhatsApp.",
      "brands": [
        "Denso"
      ],
      "vehicles": [
        "Mitsubishi Pajero Sport 2.4 MIVEC Diesel",
        "Mitsubishi Pajero Sport 2.4 MIVEC Diesel"
      ],
      "price_range": "R$ 2.200 - R$ 2.400",
      "free_shipping": true
    }
  }
}
