{
  "_doc": "LP Boxer — cobre 1 variante(s) de motor que o M8 vende. Slug por modelo (estilo Amarok).",
  "slug": "boxer",
  "categoria": "bico-injetor",
  "veiculo_key": "boxer",
  "veiculo": {
    "marca_aliases": [
      "PEUGEOT"
    ],
    "modelo_aliases": [
      "BOXER"
    ],
    "motor_por_cv": {
      "120": "2.3 Multijet",
      "127": "2.3 Multijet",
      "130": "2.3 Multijet",
      "150": "2.3 Multijet"
    }
  },
  "hero": {
    "eyebrow": "COMPRA SEGURA. ENTREGA GARANTIDA.",
    "h1_linha1": "BICO INJETOR",
    "h1_linha2": "BOXER",
    "h1_sub": "Original Bosch",
    "sub": "Para Boxer 2.3 Multijet.",
    "foto_static": "assets/boxer-static.webp",
    "foto_alt": "Boxer branca em ângulo lateral",
    "bg_position_mobile": "50% 50%",
    "bg_position_desktop": "62% center",
    "cta_mobile_label": "ACHAR O BICO CERTO"
  },
  "selector": {
    "titulo_l1": "Encontre o bico certo",
    "titulo_l2": "pro seu veículo",
    "subtexto": "Consultamos FIPE/Denatran pra você comprar a peça certa."
  },
  "peca": {
    "nome": "BICO INJETOR BOSCH",
    "short_label": "BICO BOSCH",
    "fabricante_label": "OEM BOSCH",
    "fabricante_principal_short": "Bosch",
    "motores_label": "2.3 Multijet",
    "fabricantes_aceitos": [
      "Bosch"
    ],
    "foto_default": "/injecao-diesel/pecas/0445110520.webp",
    "foto_alt": "Bico injetor original",
    "fotos_por_oem": {
      "0445110520": "/injecao-diesel/pecas/0445110520.webp",
      "0445110273": "/injecao-diesel/pecas/0445110273.webp"
    },
    "tem_primeira_linha": false,
    "equivalentes_por_motor": {
      "2.3 Multijet": [
        "0445110520",
        "0445110273"
      ]
    },
    "bullets_default": [
      "Peça original de fábrica",
      "Garantia do fabricante",
      "Pronta entrega de Chapecó/SC"
    ],
    "bullets_unknown": [
      "Peça compatível com seu Boxer",
      "Entrega de Chapecó/SC pra todo Brasil",
      "Garantia de fábrica + Armazém"
    ]
  },
  "result_messages": {
    "default_oem_unknown": "Consulte no WhatsApp",
    "hint_primeira_linha_bold": "Também temos opções alternativas",
    "hint_primeira_linha_tail": "para alguns motores. Consulte no WhatsApp.",
    "not_supported_default": "Esta LP é específica para Peugeot Boxer. Fale com a gente no WhatsApp pra consultar peças do seu veículo."
  },
  "wa": {
    "hero_link": "Olá, quero falar com um vendedor sobre bico injetor pra Boxer.",
    "fab_default": "Olá, cheguei pela landing page e quero falar sobre bico injetor pra Boxer.",
    "result_plate_template": "Olá, consultei a placa {plate} na landing page e vi o bico injetor {oem} pra meu {modelo} {ano} {motor}. Quero cotar.",
    "result_year_template": "Olá, quero cotar o bico injetor {oem} pra Boxer {year} {motor}.",
    "result_dontknow_motor": "Olá, não sei qual é o motor do meu Boxer. Podem me ajudar?",
    "result_notfound_template": "Olá, tentei buscar {query} na landing page e não encontrou. Podem me ajudar?",
    "result_notsupported_template": "Olá, consultei {query} na landing page Boxer e meu veículo é {ident}. Podem me ajudar a encontrar a peça?",
    "result_error_template": "Olá, tentei consultar {query} na landing page e deu erro. Podem me ajudar?",
    "final_cta": "Olá, quero falar com o vendedor sobre bico injetor pra Boxer."
  },
  "why": {
    "h2_l1": "Bico injetor é segurança.",
    "h2_l2": "Escolha errada",
    "h2_l2_red": "custa caro",
    "items": [
      {
        "num": "01",
        "ttl": "Compatibilidade que não erra.",
        "body": "Nosso sistema cruza sua placa com FIPE/Denatran. Você compra o bico certo pro motor certo, no ano certo do seu Boxer. Sem achismo, sem telefone trocado, sem peça voltando."
      },
      {
        "num": "02",
        "ttl": "A marca que o fabricante recomenda.",
        "body": "Bosch — a marca homologada de fábrica no Boxer, com código OEM confirmado."
      },
      {
        "num": "03",
        "ttl": "Seu Boxer volta a rodar no mesmo dia.",
        "body": "Estoque em Chapecó/SC. Saída direta pra transportadora no mesmo dia útil da confirmação. Sua frota não fica parada esperando peça."
      }
    ]
  },
  "final_cta": {
    "h2_l1": "Pronto pra",
    "h2_l2_red_l1": "voltar",
    "h2_l2_red_l2": "a rodar",
    "sub_pre": "Insira sua placa no",
    "sub_anchor": "seletor acima",
    "sub_post": "ou chame direto no WhatsApp.",
    "btn": "FALAR COM O VENDEDOR AGORA",
    "microtext_pre": "WhatsApp",
    "microtext_post": "— resposta em minutos, de segunda a sexta."
  },
  "technical_block": {
    "_doc": "Bloco técnico-educacional. Reforça keyword Boxer + 2.3 Multijet.",
    "heading": "Como saber se o bico injetor do seu Boxer está com problema",
    "intro": "O bico injetor do Boxer (2.3 Multijet) é responsável por atomizar o diesel na câmara de combustão com precisão milimétrica. Quando ele começa a falhar, os sinais aparecem antes da pane total, e identificar cedo evita um conserto de motor muito mais caro.",
    "symptoms": [
      "Fumaça preta ou branca no escapamento",
      "Perda de potência em aceleração e em subida com carga",
      "Consumo de combustível acima do normal",
      "Tranco ao engatar marcha ou marcha lenta irregular",
      "Dificuldade na partida a frio"
    ],
    "quality_explanation": "Bico original Bosch (OEM) é a opção confiável pro Boxer — calibrado de fábrica pro motor específico: pressão de abertura, padrão de pulverização e vedação seguem a especificação do fabricante. Bicos de procedência duvidosa — sem rastreabilidade nem homologação — podem operar fora da faixa correta e causar injeção irregular com danos ao motor a médio prazo. Em uma van que roda 200km/dia, o custo de um bico errado supera muito o preço do original.",
    "closing": "Na Armazém, identificamos o bico exato pelo número de placa ou chassi. Estoque disponível pras versões 2.3 Multijet do Boxer."
  },
  "seo": {
    "title": "Bico Injetor Peugeot Boxer Original — Armazém Auto Peças",
    "description": "Bico injetor original para Peugeot Boxer (2.3 Multijet). Identificamos seu bico pela placa ou chassi. Despacho em 24h úteis. Compra segura.",
    "og_image": "assets/boxer-static-og.webp",
    "og_image_alt": "Boxer branca em ângulo lateral",
    "twitter_description": "Bico injetor original para Peugeot Boxer (2.3 Multijet).",
    "canonical_path": "/injecao-diesel/boxer/",
    "product": {
      "name": "Bico Injetor para Peugeot Boxer",
      "description": "Bico injetor original para Peugeot Boxer (2.3 Multijet). Códigos OEM confirmados por consulta FIPE/Denatran.",
      "brands": [
        "Bosch"
      ],
      "vehicles": [
        "Peugeot Boxer 2.3 Multijet"
      ],
      "price_range": "R$ 1.500 - R$ 1.700",
      "free_shipping": true
    }
  }
}